{
  "schema_version": 1,
  "pipeline_version": "v6",
  "run_id": "daily-2026-05-31-20260531034939.-5253441a",
  "date": "2026-05-31",
  "generated_at": "2026-05-31T03:49:39.245Z",
  "items": [
    {
      "canonical_id": "github:chen08209/FlClash",
      "promptHash": "sha256:62212d64db55b11f0aa9faceb61b70afd886c8d4fa77ef76dd8a1cb41943c929",
      "locales": [
        "zh",
        "en"
      ],
      "priority": 0,
      "requested_at": "2026-05-31T03:49:39.245Z",
      "source": "github",
      "reason": "needs_tri"
    },
    {
      "canonical_id": "github:dreammis/social-auto-upload",
      "promptHash": "sha256:417fb32ff232660bdd3dc5a57d990aadd9fd02db0ded0218682bce46e41eab8f",
      "locales": [
        "zh",
        "en"
      ],
      "priority": 1,
      "requested_at": "2026-05-31T03:49:39.245Z",
      "source": "github",
      "reason": "needs_tri"
    },
    {
      "canonical_id": "github:FareedKhan-dev/train-llm-from-scratch",
      "promptHash": "sha256:7fd1c7942620cefecb03a8c04ef6058bbc3f05843da03fc257b1e06d4c794f56",
      "locales": [
        "zh",
        "en"
      ],
      "priority": 2,
      "requested_at": "2026-05-31T03:49:39.245Z",
      "source": "github",
      "reason": "needs_tri"
    },
    {
      "canonical_id": "huggingface:unsloth/gemma-4-E4B-it",
      "promptHash": "sha256:fa9f93bc5521c48e87e6f7623970a93a0073d4442b7efeb5910abbe7283d8f14",
      "locales": [
        "zh",
        "en"
      ],
      "priority": 3,
      "requested_at": "2026-05-31T03:49:39.245Z",
      "source": "huggingface",
      "reason": "needs_tri"
    },
    {
      "canonical_id": "huggingface:moonshotai/Kimi-K2.6",
      "promptHash": "sha256:22a5f0e8da76e3bb2134bc28d769c866a10f55b1526cf14493b2e8fd1b8c6856",
      "locales": [
        "zh",
        "en"
      ],
      "priority": 4,
      "requested_at": "2026-05-31T03:49:39.245Z",
      "source": "huggingface",
      "reason": "needs_tri"
    },
    {
      "canonical_id": "github:codecrafters-io/build-your-own-x",
      "promptHash": "sha256:f0cc453408c52590c9c95e035339467922e740d334a51760d2024391693233ee",
      "locales": [
        "zh",
        "en"
      ],
      "priority": 5,
      "requested_at": "2026-05-31T03:49:39.245Z",
      "source": "github",
      "reason": "needs_tri"
    },
    {
      "canonical_id": "github:anthropics/skills",
      "promptHash": "sha256:9faed3ce34610aaad63d58eb6e9b7a73f4beb857e5f04dcdd0cef940db6dabd7",
      "locales": [
        "zh",
        "en"
      ],
      "priority": 6,
      "requested_at": "2026-05-31T03:49:39.245Z",
      "source": "github",
      "reason": "needs_tri"
    },
    {
      "canonical_id": "github:microsoft/markitdown",
      "promptHash": "sha256:7616999e535914efd4659f405a035ca22f9fb94114b22bea24a473a8fe2b86ac",
      "locales": [
        "zh",
        "en"
      ],
      "priority": 7,
      "requested_at": "2026-05-31T03:49:39.245Z",
      "source": "github",
      "reason": "needs_tri"
    },
    {
      "canonical_id": "github:anthropics/claude-code",
      "promptHash": "sha256:c146ed5ca37e5d0bda02deab9e76fa7a707548427b4d4494db2e2f05c9c91acd",
      "locales": [
        "zh",
        "en"
      ],
      "priority": 8,
      "requested_at": "2026-05-31T03:49:39.245Z",
      "source": "github",
      "reason": "needs_tri"
    },
    {
      "canonical_id": "github:sindresorhus/awesome",
      "promptHash": "sha256:2724fb8aae725474927df4f6b45de69bae28d10fbcf1a45f9da35c228ebe25de",
      "locales": [
        "zh",
        "en"
      ],
      "priority": 9,
      "requested_at": "2026-05-31T03:49:39.245Z",
      "source": "github",
      "reason": "needs_tri"
    },
    {
      "canonical_id": "huggingface:sentence-transformers/all-MiniLM-L6-v2",
      "promptHash": "sha256:8ca19d098c0d5ea46046da1c9f3b1a75106bb839b2c9e9dd8eef54e1c97f811a",
      "locales": [
        "zh",
        "en"
      ],
      "priority": 10,
      "requested_at": "2026-05-31T03:49:39.245Z",
      "source": "huggingface",
      "reason": "needs_tri"
    },
    {
      "canonical_id": "huggingface:google-bert/bert-base-uncased",
      "promptHash": "sha256:103bf1cded07197c1a0c664f6dcb115c0d0822e3d00b7dfad50034a8b7a28f29",
      "locales": [
        "zh",
        "en"
      ],
      "priority": 11,
      "requested_at": "2026-05-31T03:49:39.245Z",
      "source": "huggingface",
      "reason": "needs_tri"
    },
    {
      "canonical_id": "huggingface:cross-encoder/ms-marco-MiniLM-L6-v2",
      "promptHash": "sha256:e870990c5b3a25ae59fcf44e1245c0641a539ed34ccc7b8fa7795cfff5731ee3",
      "locales": [
        "zh",
        "en"
      ],
      "priority": 12,
      "requested_at": "2026-05-31T03:49:39.245Z",
      "source": "huggingface",
      "reason": "needs_tri"
    },
    {
      "canonical_id": "huggingface:google/electra-base-discriminator",
      "promptHash": "sha256:b7a35829f521c4fdcddf87805ac9f16ebd258cc548173cdfb983730156ddf6b9",
      "locales": [
        "zh",
        "en"
      ],
      "priority": 13,
      "requested_at": "2026-05-31T03:49:39.245Z",
      "source": "huggingface",
      "reason": "needs_tri"
    },
    {
      "canonical_id": "huggingface:BAAI/bge-small-en-v1.5",
      "promptHash": "sha256:5ed6cb6fb5aa934e43677a957100253b7a8572eaddddcf9750de5c99dd45f1f3",
      "locales": [
        "zh",
        "en"
      ],
      "priority": 14,
      "requested_at": "2026-05-31T03:49:39.245Z",
      "source": "huggingface",
      "reason": "needs_tri"
    }
  ],
  "stats": {
    "total": 15,
    "new": 15,
    "existing": 0
  }
}
