{
  "schema_version": 1,
  "pipeline_version": "v6",
  "run_id": "daily-2025-12-10-20251210030647.-0f419194",
  "date": "2025-12-10",
  "generated_at": "2025-12-10T03:06:47.748Z",
  "items": [
    {
      "canonical_id": "huggingface:rhasspy/faster-whisper-tiny-int8",
      "promptHash": "sha256:75c7446dcae9ef36766050bdca4c37e96a645f979fa63b525e1ee49f005221ee",
      "locales": [
        "zh",
        "en"
      ],
      "priority": 0,
      "requested_at": "2025-12-10T03:06:47.748Z",
      "source": "huggingface",
      "reason": "needs_tri"
    },
    {
      "canonical_id": "github:codecrafters-io/build-your-own-x",
      "promptHash": "sha256:f0cc453408c52590c9c95e035339467922e740d334a51760d2024391693233ee",
      "locales": [
        "zh",
        "en"
      ],
      "priority": 1,
      "requested_at": "2025-12-10T03:06:47.748Z",
      "source": "github",
      "reason": "needs_tri"
    },
    {
      "canonical_id": "github:freeCodeCamp/freeCodeCamp",
      "promptHash": "sha256:7ce99892d88148e7d5cae0b4fc07936e1c16cb26ec455fb4ce856749a954c941",
      "locales": [
        "zh",
        "en"
      ],
      "priority": 2,
      "requested_at": "2025-12-10T03:06:47.748Z",
      "source": "github",
      "reason": "needs_tri"
    },
    {
      "canonical_id": "github:sindresorhus/awesome",
      "promptHash": "sha256:2724fb8aae725474927df4f6b45de69bae28d10fbcf1a45f9da35c228ebe25de",
      "locales": [
        "zh",
        "en"
      ],
      "priority": 3,
      "requested_at": "2025-12-10T03:06:47.748Z",
      "source": "github",
      "reason": "needs_tri"
    },
    {
      "canonical_id": "github:EbookFoundation/free-programming-books",
      "promptHash": "sha256:f498b06b6c0acc167c4862603584f4df565b0c479f8ee125ddcb7f6ddcef5d05",
      "locales": [
        "zh",
        "en"
      ],
      "priority": 4,
      "requested_at": "2025-12-10T03:06:47.748Z",
      "source": "github",
      "reason": "needs_tri"
    },
    {
      "canonical_id": "github:public-apis/public-apis",
      "promptHash": "sha256:2f7e803145c8932a8d3a6af2351a8c66d6db19e0b3d661aba966423d3b32968f",
      "locales": [
        "zh",
        "en"
      ],
      "priority": 5,
      "requested_at": "2025-12-10T03:06:47.748Z",
      "source": "github",
      "reason": "needs_tri"
    },
    {
      "canonical_id": "huggingface:sentence-transformers/all-MiniLM-L6-v2",
      "promptHash": "sha256:8ca19d098c0d5ea46046da1c9f3b1a75106bb839b2c9e9dd8eef54e1c97f811a",
      "locales": [
        "zh",
        "en"
      ],
      "priority": 6,
      "requested_at": "2025-12-10T03:06:47.748Z",
      "source": "huggingface",
      "reason": "needs_tri"
    },
    {
      "canonical_id": "huggingface:Falconsai/nsfw_image_detection",
      "promptHash": "sha256:d68f22b78f483c3f4da589cd97abc6ccedca740c144f8eea8eea06dbc1b3527d",
      "locales": [
        "zh",
        "en"
      ],
      "priority": 7,
      "requested_at": "2025-12-10T03:06:47.748Z",
      "source": "huggingface",
      "reason": "needs_tri"
    },
    {
      "canonical_id": "huggingface:google/electra-base-discriminator",
      "promptHash": "sha256:b7a35829f521c4fdcddf87805ac9f16ebd258cc548173cdfb983730156ddf6b9",
      "locales": [
        "zh",
        "en"
      ],
      "priority": 8,
      "requested_at": "2025-12-10T03:06:47.748Z",
      "source": "huggingface",
      "reason": "needs_tri"
    },
    {
      "canonical_id": "huggingface:google-bert/bert-base-uncased",
      "promptHash": "sha256:103bf1cded07197c1a0c664f6dcb115c0d0822e3d00b7dfad50034a8b7a28f29",
      "locales": [
        "zh",
        "en"
      ],
      "priority": 9,
      "requested_at": "2025-12-10T03:06:47.748Z",
      "source": "huggingface",
      "reason": "needs_tri"
    },
    {
      "canonical_id": "huggingface:dima806/fairface_age_image_detection",
      "promptHash": "sha256:d4ebed2fed33cd009380729ce8833b808d63b9f427e856535d0929ba5f9896f4",
      "locales": [
        "zh",
        "en"
      ],
      "priority": 10,
      "requested_at": "2025-12-10T03:06:47.748Z",
      "source": "huggingface",
      "reason": "needs_tri"
    }
  ],
  "stats": {
    "total": 11,
    "new": 11,
    "existing": 0
  }
}
