{
  "schema_version": 1,
  "pipeline_version": "v6",
  "run_id": "daily-2026-03-04-20260304032057.-b003a637",
  "date": "2026-03-04",
  "generated_at": "2026-03-04T03:20:58.100Z",
  "items": [
    {
      "canonical_id": "github:agentscope-ai/agentscope",
      "promptHash": "sha256:7259289712fdd8fe315c6502c762ca1dfd627a96a24b64857fdbcd1794afd6b4",
      "locales": [
        "zh",
        "en"
      ],
      "priority": 0,
      "requested_at": "2026-03-04T03:20:58.100Z",
      "source": "github",
      "reason": "needs_tri"
    },
    {
      "canonical_id": "github:LMCache/LMCache",
      "promptHash": "sha256:48897ba07773298b7095c983a52800d92847bce7b7817e3ed3e5cb6c747f536f",
      "locales": [
        "zh",
        "en"
      ],
      "priority": 1,
      "requested_at": "2026-03-04T03:20:58.100Z",
      "source": "github",
      "reason": "needs_tri"
    },
    {
      "canonical_id": "github:CodebuffAI/codebuff",
      "promptHash": "sha256:3e26432a1d138b95efc33acbc5e28499510de6fa8c6c34e6938a06fc5d0b6a46",
      "locales": [
        "zh",
        "en"
      ],
      "priority": 2,
      "requested_at": "2026-03-04T03:20:58.100Z",
      "source": "github",
      "reason": "needs_tri"
    },
    {
      "canonical_id": "github:agentscope-ai/ReMe",
      "promptHash": "sha256:0cc14054c5277eb5753759a45d8ad12d1e80436d918d934a2216ce3be52d8f70",
      "locales": [
        "zh",
        "en"
      ],
      "priority": 3,
      "requested_at": "2026-03-04T03:20:58.100Z",
      "source": "github",
      "reason": "needs_tri"
    },
    {
      "canonical_id": "huggingface:apple/DFN5B-CLIP-ViT-H-14-378",
      "promptHash": "sha256:fd13ec07986bbe0c24c22fa9fd49e5de18bb506287b3e76aae14fa860c5a0770",
      "locales": [
        "zh",
        "en"
      ],
      "priority": 4,
      "requested_at": "2026-03-04T03:20:58.100Z",
      "source": "huggingface",
      "reason": "needs_tri"
    },
    {
      "canonical_id": "huggingface:amazon/chronos-t5-base",
      "promptHash": "sha256:64bf777d314db6e6a8d6e060f07e492b078bef38c08dc00507e79f3a93288f26",
      "locales": [
        "zh",
        "en"
      ],
      "priority": 5,
      "requested_at": "2026-03-04T03:20:58.100Z",
      "source": "huggingface",
      "reason": "needs_tri"
    },
    {
      "canonical_id": "github:codecrafters-io/build-your-own-x",
      "promptHash": "sha256:f0cc453408c52590c9c95e035339467922e740d334a51760d2024391693233ee",
      "locales": [
        "zh",
        "en"
      ],
      "priority": 6,
      "requested_at": "2026-03-04T03:20:58.100Z",
      "source": "github",
      "reason": "needs_tri"
    },
    {
      "canonical_id": "github:sindresorhus/awesome",
      "promptHash": "sha256:2724fb8aae725474927df4f6b45de69bae28d10fbcf1a45f9da35c228ebe25de",
      "locales": [
        "zh",
        "en"
      ],
      "priority": 7,
      "requested_at": "2026-03-04T03:20:58.100Z",
      "source": "github",
      "reason": "needs_tri"
    },
    {
      "canonical_id": "github:freeCodeCamp/freeCodeCamp",
      "promptHash": "sha256:7ce99892d88148e7d5cae0b4fc07936e1c16cb26ec455fb4ce856749a954c941",
      "locales": [
        "zh",
        "en"
      ],
      "priority": 8,
      "requested_at": "2026-03-04T03:20:58.100Z",
      "source": "github",
      "reason": "needs_tri"
    },
    {
      "canonical_id": "github:public-apis/public-apis",
      "promptHash": "sha256:2f7e803145c8932a8d3a6af2351a8c66d6db19e0b3d661aba966423d3b32968f",
      "locales": [
        "zh",
        "en"
      ],
      "priority": 9,
      "requested_at": "2026-03-04T03:20:58.100Z",
      "source": "github",
      "reason": "needs_tri"
    },
    {
      "canonical_id": "github:EbookFoundation/free-programming-books",
      "promptHash": "sha256:f498b06b6c0acc167c4862603584f4df565b0c479f8ee125ddcb7f6ddcef5d05",
      "locales": [
        "zh",
        "en"
      ],
      "priority": 10,
      "requested_at": "2026-03-04T03:20:58.100Z",
      "source": "github",
      "reason": "needs_tri"
    },
    {
      "canonical_id": "huggingface:sentence-transformers/all-MiniLM-L6-v2",
      "promptHash": "sha256:8ca19d098c0d5ea46046da1c9f3b1a75106bb839b2c9e9dd8eef54e1c97f811a",
      "locales": [
        "zh",
        "en"
      ],
      "priority": 11,
      "requested_at": "2026-03-04T03:20:58.100Z",
      "source": "huggingface",
      "reason": "needs_tri"
    },
    {
      "canonical_id": "huggingface:google-bert/bert-base-uncased",
      "promptHash": "sha256:103bf1cded07197c1a0c664f6dcb115c0d0822e3d00b7dfad50034a8b7a28f29",
      "locales": [
        "zh",
        "en"
      ],
      "priority": 12,
      "requested_at": "2026-03-04T03:20:58.100Z",
      "source": "huggingface",
      "reason": "needs_tri"
    },
    {
      "canonical_id": "huggingface:google/electra-base-discriminator",
      "promptHash": "sha256:b7a35829f521c4fdcddf87805ac9f16ebd258cc548173cdfb983730156ddf6b9",
      "locales": [
        "zh",
        "en"
      ],
      "priority": 13,
      "requested_at": "2026-03-04T03:20:58.100Z",
      "source": "huggingface",
      "reason": "needs_tri"
    },
    {
      "canonical_id": "huggingface:Falconsai/nsfw_image_detection",
      "promptHash": "sha256:99eb3455f132a5daa0b74321d39efa65c6809414abe9e770c4103364cd72c767",
      "locales": [
        "zh",
        "en"
      ],
      "priority": 14,
      "requested_at": "2026-03-04T03:20:58.100Z",
      "source": "huggingface",
      "reason": "needs_tri"
    },
    {
      "canonical_id": "huggingface:sentence-transformers/all-mpnet-base-v2",
      "promptHash": "sha256:e001b68a1a1977c209e5cf12e683c2eb389f3a9e8445b7e17182f439cf103c9d",
      "locales": [
        "zh",
        "en"
      ],
      "priority": 15,
      "requested_at": "2026-03-04T03:20:58.100Z",
      "source": "huggingface",
      "reason": "needs_tri"
    }
  ],
  "stats": {
    "total": 16,
    "new": 16,
    "existing": 0
  }
}
