{
  "schema_version": 1,
  "pipeline_version": "v6",
  "run_id": "daily-2026-07-31-20260731035058.-0f11bb2a",
  "date": "2026-07-31",
  "generated_at": "2026-07-31T03:50:58.943Z",
  "items": [
    {
      "canonical_id": "github:ansible/ansible",
      "promptHash": "sha256:e8fbc4b34f60e7cc6f7bb45c93b72a8109cdf0de8582f721d8ae6480a48e7e6d",
      "locales": [
        "zh",
        "en"
      ],
      "priority": 0,
      "requested_at": "2026-07-31T03:50:58.943Z",
      "source": "github",
      "reason": "needs_tri"
    },
    {
      "canonical_id": "github:different-ai/openwork",
      "promptHash": "sha256:919cc3077e46298203da25f4453ed5a0a08f86126c7dbf8e979ae3083f8467d4",
      "locales": [
        "zh",
        "en"
      ],
      "priority": 1,
      "requested_at": "2026-07-31T03:50:58.943Z",
      "source": "github",
      "reason": "needs_tri"
    },
    {
      "canonical_id": "github:WhiskeySockets/Baileys",
      "promptHash": "sha256:08796d80b1e0b3959a6a4fd5e6c7f96f2490a43f8c7eb682c02aa148dcd3a535",
      "locales": [
        "zh",
        "en"
      ],
      "priority": 2,
      "requested_at": "2026-07-31T03:50:58.943Z",
      "source": "github",
      "reason": "needs_tri"
    },
    {
      "canonical_id": "github:agavra/tuicr",
      "promptHash": "sha256:170452b78ec6d1ab342b826f9ea876a66ecada3d83773af1a8e837aaa91be5da",
      "locales": [
        "zh",
        "en"
      ],
      "priority": 3,
      "requested_at": "2026-07-31T03:50:58.943Z",
      "source": "github",
      "reason": "needs_tri"
    },
    {
      "canonical_id": "github:justjavac/free-programming-books-zh_CN",
      "promptHash": "sha256:570dd7d696050bb5a7fe08263655b0492261977d25ef7ef84f36e141f96daede",
      "locales": [
        "zh",
        "en"
      ],
      "priority": 4,
      "requested_at": "2026-07-31T03:50:58.943Z",
      "source": "github",
      "reason": "needs_tri"
    },
    {
      "canonical_id": "huggingface:Qwen/Qwen3-ASR-0.6B",
      "promptHash": "sha256:b322b8f86d71369a0373b9cf433caab20808a37d60e8079b0f8b78728c8b4c11",
      "locales": [
        "zh",
        "en"
      ],
      "priority": 5,
      "requested_at": "2026-07-31T03:50:58.943Z",
      "source": "huggingface",
      "reason": "needs_tri"
    },
    {
      "canonical_id": "huggingface:Qwen/Qwen3-Embedding-4B",
      "promptHash": "sha256:63469c73131d9db203320b4e2d401400b22349167825f43295b3117faed23fac",
      "locales": [
        "zh",
        "en"
      ],
      "priority": 6,
      "requested_at": "2026-07-31T03:50:58.943Z",
      "source": "huggingface",
      "reason": "needs_tri"
    },
    {
      "canonical_id": "huggingface:datalab-to/chandra-ocr-2",
      "promptHash": "sha256:0b6c609f8d6e916da8ebbaec3b75d318b3d32ef8aeb74b9533395cca9856fe12",
      "locales": [
        "zh",
        "en"
      ],
      "priority": 7,
      "requested_at": "2026-07-31T03:50:58.943Z",
      "source": "huggingface",
      "reason": "needs_tri"
    },
    {
      "canonical_id": "github:affaan-m/ECC",
      "promptHash": "sha256:dddcbbde8b8aa66417c420eadb598b9c85f5f40392a6b5a33f6a3d32ec403e74",
      "locales": [
        "zh",
        "en"
      ],
      "priority": 8,
      "requested_at": "2026-07-31T03:50:58.943Z",
      "source": "github",
      "reason": "needs_tri"
    },
    {
      "canonical_id": "github:microsoft/PowerToys",
      "promptHash": "sha256:af02bfbac0fda3b29623d1afc22b99a0ab99be5a6bc217287f6115d95fd977dd",
      "locales": [
        "zh",
        "en"
      ],
      "priority": 9,
      "requested_at": "2026-07-31T03:50:58.943Z",
      "source": "github",
      "reason": "needs_tri"
    },
    {
      "canonical_id": "github:codecrafters-io/build-your-own-x",
      "promptHash": "sha256:f0cc453408c52590c9c95e035339467922e740d334a51760d2024391693233ee",
      "locales": [
        "zh",
        "en"
      ],
      "priority": 10,
      "requested_at": "2026-07-31T03:50:58.943Z",
      "source": "github",
      "reason": "needs_tri"
    },
    {
      "canonical_id": "github:sindresorhus/awesome",
      "promptHash": "sha256:2724fb8aae725474927df4f6b45de69bae28d10fbcf1a45f9da35c228ebe25de",
      "locales": [
        "zh",
        "en"
      ],
      "priority": 11,
      "requested_at": "2026-07-31T03:50:58.943Z",
      "source": "github",
      "reason": "needs_tri"
    },
    {
      "canonical_id": "github:public-apis/public-apis",
      "promptHash": "sha256:2f7e803145c8932a8d3a6af2351a8c66d6db19e0b3d661aba966423d3b32968f",
      "locales": [
        "zh",
        "en"
      ],
      "priority": 12,
      "requested_at": "2026-07-31T03:50:58.943Z",
      "source": "github",
      "reason": "needs_tri"
    },
    {
      "canonical_id": "huggingface:sentence-transformers/all-MiniLM-L6-v2",
      "promptHash": "sha256:8ca19d098c0d5ea46046da1c9f3b1a75106bb839b2c9e9dd8eef54e1c97f811a",
      "locales": [
        "zh",
        "en"
      ],
      "priority": 13,
      "requested_at": "2026-07-31T03:50:58.943Z",
      "source": "huggingface",
      "reason": "needs_tri"
    },
    {
      "canonical_id": "huggingface:google-bert/bert-base-uncased",
      "promptHash": "sha256:103bf1cded07197c1a0c664f6dcb115c0d0822e3d00b7dfad50034a8b7a28f29",
      "locales": [
        "zh",
        "en"
      ],
      "priority": 14,
      "requested_at": "2026-07-31T03:50:58.943Z",
      "source": "huggingface",
      "reason": "needs_tri"
    },
    {
      "canonical_id": "huggingface:cross-encoder/ms-marco-MiniLM-L6-v2",
      "promptHash": "sha256:e870990c5b3a25ae59fcf44e1245c0641a539ed34ccc7b8fa7795cfff5731ee3",
      "locales": [
        "zh",
        "en"
      ],
      "priority": 15,
      "requested_at": "2026-07-31T03:50:58.943Z",
      "source": "huggingface",
      "reason": "needs_tri"
    },
    {
      "canonical_id": "huggingface:BAAI/bge-small-en-v1.5",
      "promptHash": "sha256:5ed6cb6fb5aa934e43677a957100253b7a8572eaddddcf9750de5c99dd45f1f3",
      "locales": [
        "zh",
        "en"
      ],
      "priority": 16,
      "requested_at": "2026-07-31T03:50:58.943Z",
      "source": "huggingface",
      "reason": "needs_tri"
    },
    {
      "canonical_id": "huggingface:sentence-transformers/paraphrase-multilingual-MiniLM-L12-v2",
      "promptHash": "sha256:44bbd0a9704390ac4236b71663254047d3c457959e94c1f976bfeb2db4d5c489",
      "locales": [
        "zh",
        "en"
      ],
      "priority": 17,
      "requested_at": "2026-07-31T03:50:58.943Z",
      "source": "huggingface",
      "reason": "needs_tri"
    }
  ],
  "stats": {
    "total": 18,
    "new": 18,
    "existing": 0
  }
}
