{
  "schema_version": 1,
  "pipeline_version": "v6",
  "run_id": "daily-2026-04-25-20260425033839.-0ed6e675",
  "date": "2026-04-25",
  "generated_at": "2026-04-25T03:38:39.786Z",
  "items": [
    {
      "canonical_id": "github:dani-garcia/vaultwarden",
      "promptHash": "sha256:85a7f11b40ca9cc69a9ce237a033f58d49bc2dde837535d92ddfd39776f00079",
      "locales": [
        "zh",
        "en"
      ],
      "priority": 0,
      "requested_at": "2026-04-25T03:38:39.786Z",
      "source": "github",
      "reason": "needs_tri"
    },
    {
      "canonical_id": "github:microsoft/typescript-go",
      "promptHash": "sha256:81bf7269f76067cf046b2ff1e6e1605aad6fdede3a71206627990fcaa6eec684",
      "locales": [
        "zh",
        "en"
      ],
      "priority": 1,
      "requested_at": "2026-04-25T03:38:39.786Z",
      "source": "github",
      "reason": "needs_tri"
    },
    {
      "canonical_id": "github:google/osv-scanner",
      "promptHash": "sha256:866d26a9e314d5cb9cda08f382bc2f6c39007bdd279cf736222303aafd5429f4",
      "locales": [
        "zh",
        "en"
      ],
      "priority": 2,
      "requested_at": "2026-04-25T03:38:39.786Z",
      "source": "github",
      "reason": "needs_tri"
    },
    {
      "canonical_id": "github:deepseek-ai/DeepEP",
      "promptHash": "sha256:99e9d4fe86ce789d6eed46fde465d0f6fcc3d55dfb1a267b924ccc4c03448a14",
      "locales": [
        "zh",
        "en"
      ],
      "priority": 3,
      "requested_at": "2026-04-25T03:38:39.786Z",
      "source": "github",
      "reason": "needs_tri"
    },
    {
      "canonical_id": "huggingface:google/gemma-4-E2B-it",
      "promptHash": "sha256:cf81b98b654ab76f0001fa30e3dcb5d6522e1fab98b01921be623460e5def27a",
      "locales": [
        "zh",
        "en"
      ],
      "priority": 4,
      "requested_at": "2026-04-25T03:38:39.786Z",
      "source": "huggingface",
      "reason": "needs_tri"
    },
    {
      "canonical_id": "github:codecrafters-io/build-your-own-x",
      "promptHash": "sha256:f0cc453408c52590c9c95e035339467922e740d334a51760d2024391693233ee",
      "locales": [
        "zh",
        "en"
      ],
      "priority": 5,
      "requested_at": "2026-04-25T03:38:39.786Z",
      "source": "github",
      "reason": "needs_tri"
    },
    {
      "canonical_id": "github:sindresorhus/awesome",
      "promptHash": "sha256:2724fb8aae725474927df4f6b45de69bae28d10fbcf1a45f9da35c228ebe25de",
      "locales": [
        "zh",
        "en"
      ],
      "priority": 6,
      "requested_at": "2026-04-25T03:38:39.786Z",
      "source": "github",
      "reason": "needs_tri"
    },
    {
      "canonical_id": "github:freeCodeCamp/freeCodeCamp",
      "promptHash": "sha256:7ce99892d88148e7d5cae0b4fc07936e1c16cb26ec455fb4ce856749a954c941",
      "locales": [
        "zh",
        "en"
      ],
      "priority": 7,
      "requested_at": "2026-04-25T03:38:39.786Z",
      "source": "github",
      "reason": "needs_tri"
    },
    {
      "canonical_id": "github:public-apis/public-apis",
      "promptHash": "sha256:2f7e803145c8932a8d3a6af2351a8c66d6db19e0b3d661aba966423d3b32968f",
      "locales": [
        "zh",
        "en"
      ],
      "priority": 8,
      "requested_at": "2026-04-25T03:38:39.786Z",
      "source": "github",
      "reason": "needs_tri"
    },
    {
      "canonical_id": "github:EbookFoundation/free-programming-books",
      "promptHash": "sha256:f498b06b6c0acc167c4862603584f4df565b0c479f8ee125ddcb7f6ddcef5d05",
      "locales": [
        "zh",
        "en"
      ],
      "priority": 9,
      "requested_at": "2026-04-25T03:38:39.786Z",
      "source": "github",
      "reason": "needs_tri"
    },
    {
      "canonical_id": "huggingface:sentence-transformers/all-MiniLM-L6-v2",
      "promptHash": "sha256:8ca19d098c0d5ea46046da1c9f3b1a75106bb839b2c9e9dd8eef54e1c97f811a",
      "locales": [
        "zh",
        "en"
      ],
      "priority": 10,
      "requested_at": "2026-04-25T03:38:39.786Z",
      "source": "huggingface",
      "reason": "needs_tri"
    },
    {
      "canonical_id": "huggingface:Qwen/Qwen3-VL-2B-Instruct",
      "promptHash": "sha256:23dec1cb849aab00633aff4bbf31be36b2392c5b9a33ca0af2e1b5502e620a13",
      "locales": [
        "zh",
        "en"
      ],
      "priority": 11,
      "requested_at": "2026-04-25T03:38:39.786Z",
      "source": "huggingface",
      "reason": "needs_tri"
    },
    {
      "canonical_id": "huggingface:google-bert/bert-base-uncased",
      "promptHash": "sha256:103bf1cded07197c1a0c664f6dcb115c0d0822e3d00b7dfad50034a8b7a28f29",
      "locales": [
        "zh",
        "en"
      ],
      "priority": 12,
      "requested_at": "2026-04-25T03:38:39.786Z",
      "source": "huggingface",
      "reason": "needs_tri"
    },
    {
      "canonical_id": "huggingface:google/electra-base-discriminator",
      "promptHash": "sha256:b7a35829f521c4fdcddf87805ac9f16ebd258cc548173cdfb983730156ddf6b9",
      "locales": [
        "zh",
        "en"
      ],
      "priority": 13,
      "requested_at": "2026-04-25T03:38:39.786Z",
      "source": "huggingface",
      "reason": "needs_tri"
    },
    {
      "canonical_id": "huggingface:sentence-transformers/paraphrase-multilingual-MiniLM-L12-v2",
      "promptHash": "sha256:44bbd0a9704390ac4236b71663254047d3c457959e94c1f976bfeb2db4d5c489",
      "locales": [
        "zh",
        "en"
      ],
      "priority": 14,
      "requested_at": "2026-04-25T03:38:39.786Z",
      "source": "huggingface",
      "reason": "needs_tri"
    }
  ],
  "stats": {
    "total": 15,
    "new": 15,
    "existing": 0
  }
}
