{
  "schema_version": 1,
  "pipeline_version": "v6",
  "run_id": "daily-2026-06-27-20260627035329.-5d808973",
  "date": "2026-06-27",
  "generated_at": "2026-06-27T03:53:29.893Z",
  "items": [
    {
      "canonical_id": "github:grafana/grafana",
      "promptHash": "sha256:f538994d0b3d5db30567dd176e6b36dbcea4d436fb7f830637a455c679533438",
      "locales": [
        "zh",
        "en"
      ],
      "priority": 0,
      "requested_at": "2026-06-27T03:53:29.893Z",
      "source": "github",
      "reason": "needs_tri"
    },
    {
      "canonical_id": "github:opendatalab/MinerU",
      "promptHash": "sha256:ac9f554d773bbff0511b6e8924bebc004292baeb809b9e677d83f7b3aa0cfcdb",
      "locales": [
        "zh",
        "en"
      ],
      "priority": 1,
      "requested_at": "2026-06-27T03:53:29.893Z",
      "source": "github",
      "reason": "needs_tri"
    },
    {
      "canonical_id": "github:commaai/openpilot",
      "promptHash": "sha256:10b759d4de020762d5bac5a83eab629f2e10b8078207dc19c64526e7adf55aa4",
      "locales": [
        "zh",
        "en"
      ],
      "priority": 2,
      "requested_at": "2026-06-27T03:53:29.893Z",
      "source": "github",
      "reason": "needs_tri"
    },
    {
      "canonical_id": "github:IceWhaleTech/CasaOS",
      "promptHash": "sha256:b09e445c6109b2de979548f8694b4e04e800f7f65ba0e35cf6144b1e57a4266e",
      "locales": [
        "zh",
        "en"
      ],
      "priority": 3,
      "requested_at": "2026-06-27T03:53:29.893Z",
      "source": "github",
      "reason": "needs_tri"
    },
    {
      "canonical_id": "github:simplex-chat/simplex-chat",
      "promptHash": "sha256:9f88a05e54d03a914bdddb75480446f9828dcf64a02545b488cec7070b3cf641",
      "locales": [
        "zh",
        "en"
      ],
      "priority": 4,
      "requested_at": "2026-06-27T03:53:29.893Z",
      "source": "github",
      "reason": "needs_tri"
    },
    {
      "canonical_id": "github:mauriceboe/TREK",
      "promptHash": "sha256:2d6a6edfbca56e31d2eabbef19b03f144497e440864c6211bd1e62087508695e",
      "locales": [
        "zh",
        "en"
      ],
      "priority": 5,
      "requested_at": "2026-06-27T03:53:29.893Z",
      "source": "github",
      "reason": "needs_tri"
    },
    {
      "canonical_id": "github:xbtlin/ai-berkshire",
      "promptHash": "sha256:a1f4b2e78f79a76dc03e323a95d8dc56239773de8d1f0056940598dcb565a364",
      "locales": [
        "zh",
        "en"
      ],
      "priority": 6,
      "requested_at": "2026-06-27T03:53:29.893Z",
      "source": "github",
      "reason": "needs_tri"
    },
    {
      "canonical_id": "github:aws/agent-toolkit-for-aws",
      "promptHash": "sha256:c6512c4c288024f80bdd2b896cea177e646b90651dd84e758c394b7736731d6d",
      "locales": [
        "zh",
        "en"
      ],
      "priority": 7,
      "requested_at": "2026-06-27T03:53:29.893Z",
      "source": "github",
      "reason": "needs_tri"
    },
    {
      "canonical_id": "huggingface:deepseek-ai/DeepSeek-OCR-2",
      "promptHash": "sha256:60a04f68085322d71e586d602d8f210a26b9b92467d18f6e0df5267b24bf0eb8",
      "locales": [
        "zh",
        "en"
      ],
      "priority": 8,
      "requested_at": "2026-06-27T03:53:29.893Z",
      "source": "huggingface",
      "reason": "needs_tri"
    },
    {
      "canonical_id": "github:ripienaar/free-for-dev",
      "promptHash": "sha256:f16bf6481e613a57d74d48ace87ca69229efdcc6207e7922d89f6e9ef8598008",
      "locales": [
        "zh",
        "en"
      ],
      "priority": 9,
      "requested_at": "2026-06-27T03:53:29.893Z",
      "source": "github",
      "reason": "needs_tri"
    },
    {
      "canonical_id": "github:garrytan/gstack",
      "promptHash": "sha256:cf912d3e43dc86aa86ba7fbe820628b6351b253da9c59d5249fc4cf2b948c45b",
      "locales": [
        "zh",
        "en"
      ],
      "priority": 10,
      "requested_at": "2026-06-27T03:53:29.893Z",
      "source": "github",
      "reason": "needs_tri"
    },
    {
      "canonical_id": "github:codecrafters-io/build-your-own-x",
      "promptHash": "sha256:f0cc453408c52590c9c95e035339467922e740d334a51760d2024391693233ee",
      "locales": [
        "zh",
        "en"
      ],
      "priority": 11,
      "requested_at": "2026-06-27T03:53:29.893Z",
      "source": "github",
      "reason": "needs_tri"
    },
    {
      "canonical_id": "github:sindresorhus/awesome",
      "promptHash": "sha256:2724fb8aae725474927df4f6b45de69bae28d10fbcf1a45f9da35c228ebe25de",
      "locales": [
        "zh",
        "en"
      ],
      "priority": 12,
      "requested_at": "2026-06-27T03:53:29.893Z",
      "source": "github",
      "reason": "needs_tri"
    },
    {
      "canonical_id": "github:freeCodeCamp/freeCodeCamp",
      "promptHash": "sha256:7ce99892d88148e7d5cae0b4fc07936e1c16cb26ec455fb4ce856749a954c941",
      "locales": [
        "zh",
        "en"
      ],
      "priority": 13,
      "requested_at": "2026-06-27T03:53:29.893Z",
      "source": "github",
      "reason": "needs_tri"
    },
    {
      "canonical_id": "huggingface:sentence-transformers/all-MiniLM-L6-v2",
      "promptHash": "sha256:8ca19d098c0d5ea46046da1c9f3b1a75106bb839b2c9e9dd8eef54e1c97f811a",
      "locales": [
        "zh",
        "en"
      ],
      "priority": 14,
      "requested_at": "2026-06-27T03:53:29.893Z",
      "source": "huggingface",
      "reason": "needs_tri"
    },
    {
      "canonical_id": "huggingface:cross-encoder/ms-marco-MiniLM-L6-v2",
      "promptHash": "sha256:e870990c5b3a25ae59fcf44e1245c0641a539ed34ccc7b8fa7795cfff5731ee3",
      "locales": [
        "zh",
        "en"
      ],
      "priority": 15,
      "requested_at": "2026-06-27T03:53:29.893Z",
      "source": "huggingface",
      "reason": "needs_tri"
    },
    {
      "canonical_id": "huggingface:BAAI/bge-small-en-v1.5",
      "promptHash": "sha256:5ed6cb6fb5aa934e43677a957100253b7a8572eaddddcf9750de5c99dd45f1f3",
      "locales": [
        "zh",
        "en"
      ],
      "priority": 16,
      "requested_at": "2026-06-27T03:53:29.893Z",
      "source": "huggingface",
      "reason": "needs_tri"
    },
    {
      "canonical_id": "huggingface:google-bert/bert-base-uncased",
      "promptHash": "sha256:103bf1cded07197c1a0c664f6dcb115c0d0822e3d00b7dfad50034a8b7a28f29",
      "locales": [
        "zh",
        "en"
      ],
      "priority": 17,
      "requested_at": "2026-06-27T03:53:29.893Z",
      "source": "huggingface",
      "reason": "needs_tri"
    },
    {
      "canonical_id": "huggingface:sentence-transformers/paraphrase-multilingual-MiniLM-L12-v2",
      "promptHash": "sha256:44bbd0a9704390ac4236b71663254047d3c457959e94c1f976bfeb2db4d5c489",
      "locales": [
        "zh",
        "en"
      ],
      "priority": 18,
      "requested_at": "2026-06-27T03:53:29.893Z",
      "source": "huggingface",
      "reason": "needs_tri"
    }
  ],
  "stats": {
    "total": 19,
    "new": 19,
    "existing": 0
  }
}
